,Unnamed: 0.1,Unnamed: 0,price,artist,fame,title,yearCreation,signed,condition,period,movement
463,463,463,1.500 USD,Laura Newman,0.0,Biomorphic Furniture ,1989,[nan],Not examined out of frame. Sheet undulation. Numerical inscriptions in pencil at back of frame.,Post-War,Abstract
464,464,464,1.500 USD,Robert Parker,0.0,Irish Interior,[nan],Signed in ink lower middle,Not examined outside of frame. Paper has a noticeable seam across the middle of the image.  ,Post-War,Expressionism
465,465,465,800 USD,Mary Jo Vath,0.0,Untitled ,2003,Signed and dated in pencil recto.,This work is in good condition.Not examined out of frame.Minor sheet undulation.,Contemporary,Realism
466,466,466,800 USD,Stuart Nielsen,0.0,Shell/Butterfly,1978,Signed and dated in pencil upper left.,This work is in very good condition.Not examined outside of frame.No obvious defects to artwork.,Post-War,Expressionism
467,467,467,800 USD,Marcia Scanlon,0.0,Millhollow,[nan],Signed in pencil lower right corner.,This work is in very good condition.Not examined outside of frame.Light smudges to frame.,Post-War,Realism
468,468,468,800 USD,Neil Winokur,83.0,Tools,1990,[nan],This work is in good condition.Minor wear to finish.Back is lined with paper that is unaffixed in some areas.,Post-War,Realism
469,469,469,1.500 USD,Willie White,0.0,Untitled,1986,[nan],Not examined outside of frame. No obvious defects to artwork.,Post-War,Expressionism
470,470,470,800 USD,Elspeth Lamb,0.0,Anaktos,1989,[nan],This work is in very good condition.Not examined outside of frame.No obvious defects to artwork.,Post-War,Abstract
471,471,471,1.500 USD,Leatrice Rose,0.0,Bananas,[nan],Signed in pencil lower right corner,This work is in very good condition.Not examined outside of frame.Slight rippling to paper.Smudge on top of frame.,Post-War,Realism
472,472,472,680 USD,David Fokos,64.0,Moonrise,2001,Signed and dated lower right recto,This work is in very good condition with no obvious signs of wear to the photo.Not examined out of frame.Chips to frame.,Contemporary,Realism
473,473,473,680 USD,Suzanne Song,0.0,"Untitled, Replica V3",2008,Signed and dated verso,This work is in very good condition with no obvious signs of wear.,Contemporary,Minimalism
474,474,474,680 USD,David Fokos,64.0,Canal,2001,Signed and dated lower right recto,This work is in very good condition with no obvious signs of wear to photo.Not examined out of frame.Chips to frame.,Contemporary,Realism
475,475,475,900 USD,Philip Read,0.0,Cabbage Encompassing Earth,1990 - 1999,[nan],"This work is in overall good condition.Moderate wear to frame, more pronounced at corners.Slight marks to canvas.",Post-War,Surrealism
476,476,476,2.600 USD,Henry Schouten,0.0,Hens and Chicks,Late 19th Century ,Signed Henry Schouten on lower left,This work is in overall good condition.Small hole to canvas.Scratch to paint.,19th Century,Impressionism
477,477,477,800 USD,Alan Turner,0.0,White Landscape,1978,Signed lower right in pencil,This work is in good condition.Artwork not examined outside of frame.Small pinholes in all four corners.Light smudges to mat.,Post-War,Expressionism
478,478,478,1.500 USD,Paul Narkiewicz,0.0,Nursery,1980,[nan],Artwork not examined outside of frame.No obvious signs of wear to artwork.,Post-War,Expressionism
479,479,479,1.500 USD,Diane Sophrin,0.0,View Of Living Room,1983,[nan],Artwork not examined outside of frame.No obvious signs of wear to artwork.,Post-War,Realism
480,480,480,1.875 USD,William Lee Hankey,0.0,Coombe Village,Early 20th Century ,Signed Wm Lee-Hankey on bottom right,This work is in very good condition.Small nicks to frame.Not examined out of frame.,Modern,Impressionism
481,481,481,800 USD,Ron Trujillo,0.0,Atlantis Explosion No 4,1987,Signed R Trujillo on bottom right recto,This work is in very good condition.Artwork not examined outside of frame.No obvious signs of wear to artwork.Some scuffs and marks at corners of wood frame.,Post-War,Expressionism
482,482,482,800 USD,Joan Nelson,88.0,Untitled,1990,Signed Joan Nelson 90 in pencil in lower right recto,This work is in good condition.Artwork not examined outside of frame.No obvious signs of wear to artwork.Minor scuffs to plexiglass at bottom.Minimal signs of wear to frame.,Post-War,Expressionism
483,483,483,800 USD,Claire Van Vliet,0.0,Summer 2,1985,Signed lower right in pencil,This work is in very good condition.Artwork not examined outside of frame.No obvious signs of wear to artwork.,Post-War,Expressionism
484,484,484,1.500 USD,Sandy Walker,0.0,Beach Pastel,1979,Signed SW 79 in pencil on bottom center recto,Artwork not examined outside of frame.No obvious signs of wear to artwork.Two dents on white mat at bottom left.,Post-War,Expressionism
485,485,485,1.500 USD,Alan Turner,0.0,Autumn Covering Summer,1979,"Signed and dated in pencil, lower right",Artwork not examined outside of frame.Small pinholes in all four corners.Yellowing to paper.,Post-War,Expressionism
486,486,486,800 USD,John Shaw,0.0,Brooklyn Bridge,1983,Signed John Shaw in pencil on lower right recto,This work is in good condition.Artwork not examined outside of frame.Not obvious signs of wear to artwork.Some surface scratches to plexiglass.Minimal surface wear to frame.,Post-War,Expressionism
487,487,487,800 USD,Steven Barbash,0.0,Birds,1977,Signed and dated lower right in pencil,This work is in very good condition.Artwork not examined outside of frame.No obvious signs of wear to artwork.,Post-War,Realism
488,488,488,800 USD,JOHN BELLANY,0.0,Untitled,1987,Signed John Bellany in pencil on bottom right recto,This work is in good condition.Artwork not examined outside of frame.Minor rippling to paper.Minor surface wear to frame.,Post-War,Surrealism
489,489,489,3.000 USD,Irene Mamiye,0.0,Rays,21st Century ,[nan],This work is in very good condition.Not examined out of frame.No obvious signs of wear to art.Small chip to frame.,Contemporary,Pop Art
490,490,490,1.500 USD,Mel Pekarsky,0.0,Blue Hills,1977,"Signed and dated lower right, MP '77",This work is in good condition.Artwork not examined outside of frame.Two small holes at top right and left corners.,Post-War,Expressionism
491,491,491,800 USD,Mary Jo Vath,0.0,Lure,1989,Inscribed 14/30 M.Vath 1989 in pencil recto,This work is in very good condition.Not examined out of frame.No obvious imperfections to artwork observed.,Post-War,Expressionism
492,492,492,3.000 USD,Irene Mamiye,0.0,Rays,21st Century ,[nan],This work is in very good condition.Not examined out of frame.No obvious signs of wear to art.Small chip to frame.,Contemporary,Pop Art
493,493,493,1.500 USD,Margo Sawyer,0.0,Ascension,1987 - 1989,[nan],This work is in good condition.Artwork not examined outside of frame.No obvious signs of wear to artwork.,Post-War,Abstract
494,494,494,3.000 USD,Irene Mamiye,0.0,Rays,21st Century ,[nan],This work is in very good condition.Not examined out of frame.No obvious signs of wear to art.Small chip to frame.,Contemporary,Pop Art
495,495,495,800 USD,Jack Knox,0.0,Whale,1986,Signed lower right in pencil,This work is in good condition.Artwork not examined outside of frame.No obvious signs of wear to artwork.,Post-War,Expressionism
496,496,496,800 USD,Jack Beal,0.0,Spotted Salamander,1973,Signed Jack Beal in pencil on lower right recto,"This work is in good condition.Artwork not examined outside of frame.No obvious signs of wear to artwork.Scuffs and marks to wood frame, more significant wear at top right corner.Surface wear to plexiglass and frame.",Post-War,Expressionism
497,497,497,2.160 USD,Oskar Laske,0.0,Meadow Scene,Early 20th Century ,Signed O. Laske on bottom right,This work is in very good condition.Not examined out of frame.,Modern,Impressionism
498,498,498,1.500 USD,Joseph Sweeney,0.0,University Of PA Boathouse,1993,[nan],This work is in very good condition.Artwork not examined outside of frame.No obvious signs of wear to artwork.Smudges to mat.,Post-War,Realism
499,499,499,800 USD,Steven Campbell,0.0,Lobster,1986,Signed Steven M Campbell in pencil on bottom right recto,This work is in very good condition.Artwork not examined outside of frame.No obvious signs of wear to artwork.Minor surface wear to frame.Scratch to plexiglass across bottom.Minor separation of mitered corner of frame at lower right.,Post-War,Expressionism
500,500,500,3.000 USD,Irene Mamiye,0.0,Rays,21st Century ,[nan],This work is in very good condition.Not examined out of frame.No obvious signs of wear to art.Small mark to frame.,Contemporary,Pop Art
501,501,501,800 USD,Susana Solano,0.0,Plaça Del Joc De La Pilota IV,Circa 1987,Inscribed in pencil on lower right recto,Artwork not examined outside of frame.Minor rippling to paper.Minor surface wear to frame.,Post-War,Expressionism
502,502,502,800 USD,Deborah Brown,105.0,Todd,2001,Signed in pencil bottom right,This work is in good condition.Artwork not examined outside of frame.No obvious signs of wear to artwork.,Contemporary,Realism
503,503,503,800 USD,DON NICE,123.0,Bullfrog,1972,Signed Nice in pencil on lower right recto,This work is in good condition.Artwork not examined outside of frame.Minor discoloration to paper edges.Pin holes at corners of paper from previous hanging.Minor rippling of paper.Minor surface wear to frame.,Post-War,Realism
504,504,504,800 USD,David True,0.0,Fragile Wings,1989,Signed David True 89 in pencil on lower right rector,This work is in very good condition.Artwork not examined outside of frame.Minor rippling of paper.Minimal surface wear to frame.,Post-War,Expressionism
505,505,505,4.500 USD,Ernst Haas,0.0,"NYC, USA",1953,Signed on verso by the artist's son,"This work is in excellent condition. The colors remain bright and saturated with no apparent fading.The Haas Studio label is signed by Alexander Haas, the photographer's son and is titled, dated, editioned '1/15', and annotated in ink.",Post-War,Realism
506,506,506,800 USD,Susana Solano,0.0,Plaza Del Joc III,1988,Inscribed in pencil on lower right recto,This work is in good condition.Artwork not examined outside of frame.Minor rippling of paper.Minor surface wear to frame.,Post-War,Expressionism
507,507,507,800 USD,Deborah Brown,105.0,Sadie I,2001,Signed in pencil bottom right,This work is in good condition.Artwork not examined outside of frame.No obvious signs of wear to artwork.,Contemporary,Realism
508,508,508,1.500 USD,Sandy Walker,0.0,Ocean Series I,1978,Signed SW 78 in pencil on lower center recto,This work is in very good condition.Artwork not examined outside of frame.Minor rippling of paper.Minimal surface wear to frame.,Post-War,Expressionism
509,509,509,7.000 USD,Horst P. Horst,153.0,Nails In Technicolor,1941,[nan],"This piece is in overall very good condition. There are a few soft small creases that do not appear to break the emulsion, which are visible only in raking light.",Modern,Realism
510,510,510,1.500 USD,Donald Sanders,0.0,Night Venture,1987,[nan],Artwork not examined outside of frame.No obvious signs of wear to artwork.Some marks and scuffs on lower right corner of frame.Minor surface wear to frame.,Post-War,Expressionism
511,511,511,3.000 USD,Irene Mamiye,0.0,Rays,21st Century ,[nan],This work is in very good condition.Not examined out of frame.No obvious signs of wear to art.Small mark to frame.,Contemporary,Pop Art
512,512,512,1.500 USD,Victoria Scalfani,0.0,Shadow I,21st Century ,Signed V Scalfani in pencil at lower right recto,This work is in very good condition.Artwork not examined outside of frame.No obvious signs of wear to artwork.Minor surface wear to frame.,Contemporary,Expressionism
513,513,513,800 USD,Marcia Scanlon,0.0,Parthenon,1986,Signed in pencil at bottom,This work is in good condition.Artwork not examined outside of frame.No obvious signs of wear to artwork.Paint drip on inside of glass frame.,Post-War,Realism
514,514,514,800 USD,Norman Stevens,0.0,Stonehenge,1976,Inscribed 21/25 Stonehenge Norman Stevens in pencil recto,This work is in very good condition.Not examined out of frame.Minor creasing to sheet.,Post-War,Realism
515,515,515,800 USD,Susana Solano,0.0,Plaça Del Joc De La Pilota II,1987,Inscribed in pencil on lower right recto,This work is in very good condition.Artwork not examined outside of frame.Minor rippling of paper.Minor surface wear to frame.,Post-War,Expressionism
516,516,516,800 USD,Joan Nelson,88.0,Untitled (451 Ca),1990,Signed Joan Nelson 90 in pencil on lower right recto,This work is in good condition.Artwork not examined outside of frame.No obvious signs of wear to artwork.Minimal signs of wear to frame.,Post-War,Expressionism
517,517,517,800 USD,Marcia Scanlon,0.0,Delphi Tholos II,1985,Signed in pencil lower right,This work is in very good condition.Artwork not examined outside of frame.No obvious signs of wear to artwork.,Post-War,Realism
518,518,518,800 USD,Jack Knox,0.0,Dove,1986,Signed lower right in pencil,This work is in good condition.Artwork not examined outside of frame.No obvious signs of wear to artwork.,Post-War,Expressionism
519,519,519,800 USD,Anthony Gross,0.0,Homage To Constable (Salisbury),1976,"Numbered, titled and singed in pencil recto",This work is in good condition.Not examined out of frame.Scattered scratches to plexiglass.Faint burn marks at edges of paper.Sheet undulation.,Post-War,Impressionism
520,520,520,1.500 USD,Billy Sullivan,0.0,Palisades #4,1986,Inscribed Palisades #4 Bill Sullivan in pencil recto,This work is in very good condition.Not examined out of frame.No obvious imperfections to artwork observed.,Post-War,Realism
521,521,521,800 USD,T.L. Solien,0.0,Fragments Of Hope,1982,Artist signature and date incorporated in work,This work is in good condition.Not examined out of frame.Discoloration to edges of paper.Yellowing to background paper.,Post-War,Conceptual 
522,522,522,800 USD,T.L. Solien,0.0,Fragments Of Hope,1982,[nan],This work is in good condition.Not examined out of frame.Discoloration to edges of paper.Yellowing to background paper.Separation of frame at corner and crack to frame.,Post-War,Conceptual 
523,523,523,1.500 USD,Richard Haas,0.0,New York Central Building,1974,Signed Richard Haas in pencil on lower right recto,This work is in good condition.Artwork not examined outside of frame.Minor rippling and discoloration to paper edges.Minor wear to frame finish.,Post-War,Traditional
524,524,524,800 USD,Forrest Moses,140.0,Untitled,1979,Moses in pencil at lower right recto,This work is in good condition overall.Artwork not examined outside of frame.Minor rippling and discoloration to paper.,Post-War,Expressionism
525,525,525,800 USD,June Redfern,0.0,Seal,1986,Signed lower right recto,Not examined out of frame.No obvious signs of wear to art.,Post-War,Abstract
526,526,526,1.500 USD,David Dewey,0.0,"Morning Shadows, Marshall Point",1984,[nan],This work is in very good condition.Not examined outside of frame.No obvious damage to artwork.,Contemporary,Impressionism
527,527,527,1.500 USD,Jon Imber,0.0,"Red Bramble, Drumlin Farm",Circa 1989,Signed and dated in pencil recto,This work is in very good condition.Not examined out of frame.Minor sheet undualtion.,Post-War,Surrealism
528,528,528,1.500 USD,Mary Armstrong,0.0,Tide Pool Shuffle,1984,Signed lower right,This work is in very good condition.Not examined outside of frame.No obvious signs of damage to artwork.,Post-War,Expressionism
529,529,529,1.500 USD,Billy Sullivan,0.0,Daisy On Carpet,1981,Inscribed Billy Sullivan in pastel lower right corner recto,This work is in very good condition.Not examined out of frame.Sheet undulation due to artist's chosen working materials.,Post-War,Realism
530,530,530,1.500 USD,James Romberger,0.0,Third Street Garden,1990,Signed JAMES lower right recto,Not examined out of frame.Adhesive residue marks throughout plexiglass.Minor soiling and marks to paper.Minor sheet undulation.Blemish to frame at bottom right side.,Post-War,Realism
531,531,531,1.500 USD,Alberto Morrocco,0.0,"Berthed Boats, Camogli",1988,Artist signature and date lower left recto,This work is in very good condition.No visible signs of wear to artwork.Not examined out of frame.,Post-War,Realism
532,532,532,1.500 USD,Mary Jo Vath,0.0,Wave,1985,Artist name inscribed verso,This work is in very good condition.Not examined out of frame.No obvious signs of wear to art.Nicks and chips to frame.,Post-War,Expressionism
533,533,533,800 USD,Lucy Sallick,0.0,Indian Island II,1989,Inscribed 2/15 Indian Island II Lucy Sallick 1989 in pencil recto,This work is in good condition.Not examined out of frame.Small scattered scratches to plexiglass.,Post-War,Expressionism
534,534,534,800 USD,Gregory Crane,0.0,New Moon and Poplars,1990,Signed Gregory Crane 1990 in pencil at lower right recto,This work is in very good condition.Artwork not examined outside of frame.Minor rippling of paper consistent with process.No other obvious signs of artwork.,Post-War,Expressionism
535,535,535,1.500 USD,John Andre Gundelfinger,0.0,Untitled No. 4,1977,Signed in paint lower right corner recto,This work is in very good condition.Not examined out of frame.Minor sheet undulation due to artist's chosen working materials.,Post-War,Impressionism
536,536,536,800 USD,Steven Sorman,99.0,I Am Too,2000,[nan],This work is in good condition.Not examined outside of frame.No obvious damage to artwork.,Post-War,Abstract
537,537,537,800 USD,June Redfern,0.0,Wolf,1986,Signed lower right recto,This work is in very good condition.Not examined out of frame.No obvious signs of wear to art.,Post-War,Abstract
538,538,538,800 USD,Richard Chiriani,0.0,"A Schoharie Marsh, Spring",1984,Signed and dated recto,"This work is in very good condition.Small sticky mark to plexiglass on lower left corner, suggest cleaning.No visible signs of wear to artwork.Not examined out of frame.",Post-War,Realism
539,539,539,800 USD,Richard Mock,0.0,Alaskan Wildlife,2001,"Inscribed 5/100 ""Alaskan Wildlife"" Richard Mock 2001 in pencil recto",This work is in very good condition.Not examined out of frame.No obvious imperfections to artwork observed.,Contemporary,Conceptual 
540,540,540,800 USD,Antonio Frasconi,0.0,"Ice Crusher, Cart",1952,Signed in pencil lower right,This work is in very good condition.Not examined outside of frame.No obvious damage to artwork.,Post-War,Conceptual 
541,541,541,800 USD,Richard Crozier,0.0,"Palms III Ojai, CA",1979,Signed Richard Crozier 1979 in pencil at lower right recto,This work is in very good condition.Artwork not examined outside of frame.No obvious signs of wear to artwork.,Post-War,Expressionism
542,542,542,1.500 USD,Marilyn Duke,0.0,September,1984,[nan],Not examined out of frame.One small surface mark and one minor indentation to frame.Faint surface marks at top right corner.No visible signs of wear to artwork.,Post-War,Expressionism
543,543,543,1.500 USD,Ella Delyanis,0.0,"Study, Storm Over Bell Pond",1983,Bottom right recto,This work is in very good condition.Artwork not examined outside of frame.No obvious sign of wear to artwork.,[nan],[nan]
544,544,544,1.500 USD,T.L. Solien,0.0,Blood Tug,Late 20th Century ,[nan],This work is in very good condition.Not examined out of frame.No visible signs of wear to art.,Post-War,Expressionism
545,545,545,800 USD,Gregory Crane,0.0,A Brilliant Entrance,2003,Signed and dated lower right recto,This work is in very good condition.No visible signs of wear to artwork.Not examined out of frame.,Contemporary,Expressionism
546,546,546,800 USD,Joseph Soloman,0.0,Garden Scene,1979,Inscribed Joseph Soloman 79 bottom right corner recto,This work is in very good condition.Not examined out of frame.No obvious imperfections to artwork observed.One small mark to frame on left side.,Post-War,Expressionism
547,547,547,800 USD,June Redfern,0.0,Lion,1986,Signed lower right recto,This work is in very good condition.Not examined out of frame.Small nick to frame at top center.Small chip to paper.,Post-War,Abstract
548,548,548,800 USD,Paul Davis,0.0,Max,1977,Inscribed He Paul Davis 77 in pencil recto,This work is in good condition.Not examined out of frame.Horizontal adhesive residue mark across the top of the image.Scattered surface scratches to plexiglass.,Post-War,Expressionism
549,549,549,800 USD,Judith S. Miller,0.0,Eric Shows Me The Hidden Parks,2006,Signed and dated lower right recto,This work is in very good condition.No visible signs of wear to artwork.Not examined out of frame.,Contemporary,Realism
550,550,550,800 USD,MICHAEL MAZUR ,0.0,The Net,1977,Signed Mazur in pencil on lower right recto,This work is in very good condition.Artwork not examined outside of frame.No obvious signs of wear to artwork.Minor wear to frame surface.,Post-War,Impressionism
551,551,551,800 USD,Len Jenshel,0.0,Painted Rock State Park: Arizona,1988,[nan],This work is in very good condition.Artwork not examined outside of frame.No obvious signs of wear to artwork.,Post-War,Expressionism
552,552,552,800 USD,Billy Sullivan,0.0,Islands #8,1986,Signed and numbered in pencil recto,This work is in very good condition.Not examined out of frame.Small black mark at right corner of matte.,Post-War,Realism
553,553,553,800 USD,T.L. Solien,0.0,Fragments Of Hope,1982,[nan],This work is in good condition.Not examined out of frame.Discoloration to edges of paper.Yellowing to background paper.,Post-War,Conceptual 
554,554,554,800 USD,Lizbeth Mitty,0.0,Nightride Overpass,2001,Signed and dated lower right recto,This work is in very good condition.No visible signs of wear to artwork.Not examined out of frame.,Contemporary,Impressionism
555,555,555,800 USD,Sandra Clark,0.0,Gamberaia #10,[nan],[nan],This work is in very good condition.Not examined outside of frame.No obvious signs of damage to artwork.,Contemporary,Expressionism
556,556,556,800 USD,John Gundelfinger,0.0,Untitled No 2,1979,Signed John Gundelfinger in pencil on white backing at lower left,This work is in very good condition.Artwork not examined outside of frame.No obvious signs of wear to artwork.,Post-War,Realism
557,557,557,800 USD,Darina Karpov,0.0,Crawlers,2012,Signed and dated lower right recto,This work is in very good condition.No obvious signs of wear to art.Not examined out of frame.,Contemporary,Conceptual 
558,558,558,1.500 USD,Sally Amster,0.0,The Cove and Beyond,1981,Artist signature and date lower right recto,"No visible signs of wear to artwork.Not examined out of frame.Frame is loose, has been taped for adherence.Chips to finish on wood frame.",Post-War,Expressionism
559,559,559,800 USD,Donna Dennis,0.0,Entrance,1986,"Signed and dated in pencil, lower right.",This work is in very good condition.Not examined outside of frame.No obvious signs of damage to artwork.,Post-War,Expressionism
560,560,560,1.500 USD,Susan Laufer,0.0,Lifeline Drawing Series #28,1988,Artist signature bottom right recto,This work is in very good condition.No visible signs of wear to artwork.Not examined out of frame.,Post-War,Abstract
561,561,561,1.500 USD,Joseph A. Salvatore,0.0,Book Of Jeremiah,1981,[nan],This work is in good condition.Not examined out of frame.Mark at bottom right corner of frame.,Post-War,Conceptual 
562,562,562,800 USD,MICHAEL MAZUR ,0.0,Wakeby Island,1985,Signed lower right recto,This work is in good condition.Rippling to paper.Not examined out of frame.,Post-War,Expressionism
563,563,563,800 USD,"Peter Howson, O.B.E.",160.0,Stag,1986,Signed lower right recto.,This work is in very good condition.Not examined out of frame.No obvious signs of wear to art.,Post-War,Realism
564,564,564,800 USD,Richard Haas,0.0,Grand Central Station,1972,Signed in pencil lower right,This work is in very good condition.Not examined outside of frame.No obvious signs of damage to artwork.,Post-War,Traditional
565,565,565,1.500 USD,Richard Garrison,0.0,Untitled (Yellow),2009,[nan],This work is in very good condition.Not examined out of frame.No visible signs of wear to artwork.,Contemporary,Conceptual 
566,566,566,800 USD,Gregg Saunders,0.0,Untitled Landscape,Late 20th Century ,[nan],This work is in very good condition.Not examined out of frame.No obvious signs of wear to art.,Post-War,Realism
567,567,567,1.500 USD,Eugene Charlton-Rafalsky,0.0,Untitled Landscape,1974,"Signed and dated in pencil, lower right",This work is in very good condition.Not examined outside of frame.No obvious damage to artwork.,Post-War,Expressionism
568,568,568,800 USD,T.L. Solien,0.0,Fragments Of Hope,1982,[nan],This work is in very good condition.Not examined out of frame.Discoloration to edges of paper.Yellowing to background paper.,Post-War,Conceptual 
569,569,569,800 USD,Yvonne Jacquette,0.0,Fog River IV,1976,Signed lower right recto,This work is in very good condition.No obvious signs of wear to art.Not examined out of frame.,Post-War,Expressionism
570,570,570,800 USD,Richard Ballard,0.0,Cypress,1990,Signed and dated lower right recto,This work is in very good condition.No visible signs of wear to artwork.Not examined out of frame.,Post-War,[nan]
571,571,571,800 USD,Gregory Amenoff,0.0,Beacon Pink,1986,"Signed, dated, and titled lower right recto",This work is in very good condition.No obvious signs of damage to art.Not examined out of frame.,Post-War,Abstract
572,572,572,1.500 USD,Ray Ciarrocchi,0.0,"Cove at Bremen, Maine",1978,[nan],This work is in very good condition.Artwork not examined outside of frame.No obvious signs of wear to artwork.,Post-War,Impressionism
573,573,573,800 USD,Anne Ross,0.0,Passageway,2008,[nan],This work is in good condition.Not examined out of frame.Numerical pencil inscription at back.A few small marks to finish on frame.,Contemporary,Surrealism
574,574,574,1.500 USD,Terence LaNoue,0.0,Deccan Suite #15,1979,Signed in pastel recto,This work is in very good condition.Not examined out of frame.Minor sheet undulation due to artist's chosen working materials.,Post-War,Abstract
575,575,575,800 USD,Frances Ashforth,0.0,"Horizon Series, Wind Series 1",2011,Signed Frances B Ashforth '11 in ink on lower right recto,This work is in very good condition.Artwork not examined outside of frame.No obvious signs of wear to artwork.,Contemporary,Expressionism
