,Unnamed: 0.1,Unnamed: 0,price,artist,fame,title,yearCreation,signed,condition,period,movement
249,249,249,3.500 USD,Giuseppe Penone,128.0,Brain I,2000,"Signed in pencil at bottom right edge, numbered bottom left","The work is in excellent condition, direct from the publisher.",Contemporary,Conceptual 
250,250,250,4.500 USD,Giuseppe Penone,128.0,Brain II,2000,"Signed in pencil bottom right edge, numbered bottom left","The work is in excellent condition, direct from the publisher.",Contemporary,Conceptual 
251,251,251,21.000 USD,Abelardo Morell,130.0,After Hitchcock: Psycho. House. Tent-Camera Image,2018,"Signed and numbered in pen on a label, on verso of Dibond mount","The work is in excellent condition, direct from the publisher.",Contemporary,Conceptual 
252,252,252,4.000 USD,Guillermo Kuitca,85.0,Coat Check,2002,"Signed, dated and editioned lower right","The work is in excellent condition, direct from the publisher.",Contemporary,Geometric Abstraction
253,253,253,35.000 USD,Sam  Francis,130.0,Untitled (sfm 83-471),1983,"Signed ""Sam Francis"" in pencil on verso, inscribed ""SFM83-471 25 X 31-1/2"" in pencil on verso","The work is in excellent condition, direct from the publisher.",Contemporary,Abstract Expressionism
254,254,254,25.000 USD,Elger Esser,95.0,Hoquiam,2008,Signed on label,"The work is in excellent condition, direct from the publisher.",Contemporary,Realism
255,255,255,7.500 USD,Matthew Brandt,138.0,"Box, SN1987A-4420-sm.tif",2019,Signed on label on verso,"The work is in excellent condition, direct from the publisher.",Contemporary,Conceptual 
256,256,256,7.500 USD,Matthew Brandt,138.0,"Box, Bar-pt1-pl014_sm.jpg",2019,Signed on label on verso,"The work is in excellent condition, direct from the publisher.",Contemporary,Conceptual 
257,257,257,22.500 USD,Valérie Belin,138.0,White Narcissus in Orange (Colour Wonder),2018,Signed on labels on Dibond on verso,"The work is in excellent condition, direct from the publisher.",Contemporary,Conceptual 
258,258,258,12.500 USD,Marina Abramović,0.0,Chair for the Spirit Chair for Man,1999,Signed in pencil and numbered,"The work is in excellent condition, direct from the publisher.",Contemporary,Conceptual 
259,259,259,9.500 USD,Yong Jo Ji,0.0,Nirvana ,2014,[nan],Overall excellent condition.,Contemporary,Abstract
260,260,260,32.000 USD,Mel  Bochner,161.0,"Measurement: 41""/22""",1998,"i. signed, titled and dated 1998 on the reverseii. titled on the reverseiii. titled on the reverse",Unframed. In good condition overall.,Contemporary,Conceptual 
261,261,261,8.000 USD,Jennifer Bartlett,119.0,"Homan-Ji III, 216A",[nan],Signed and dated lower right recto in pencil,Excellent condition. Paper has decked edges. Pinhole in each corner.,Contemporary,Conceptual 
262,262,262,12.000 USD,Amedeo Simonetti,0.0,The Harem's Cobbler,Late 19th Century ,Signed Amedeo Simonetti and inscribed Roma (lower right),"Watercolor and gouache on card, hinged to a back mat with tape at the edges. There is slight rippling to the card. The surface is in generally good condition, aside from minor surface dirt and dust; some mat staining at the edges; very faint, scattered foxing and a few isolated tiny pin dot accretions; a pin dot loss at center right; and some very fine craquelure to the darker pigments on the man's sleeve at lower right and shadow of the tablecloth. The colors remain fresh. Additional former tape mounts visible verso.Framed in a gold frame with floral motifs and ready to hang in its current state.",19th Century,Traditional
263,263,263,48.000 USD,Matt Mullican,79.0,Untitled (Cosmology Signs),1991,Signed and dated verso,Excellent condition.,Contemporary,Conceptual 
264,264,264,11.000 USD,Antonio Carreno,0.0,Allegorical #2,2016,Signed lower right recto,Excellent condition.,Contemporary,Abstract Expressionism
265,265,265,11.000 USD,Antonio Carreno,0.0,Allegorical,2016,Signed lower right recto,Excellent condition.,Contemporary,Abstract Expressionism
266,266,266,40.000 USD,Frank Schroeder,0.0,Tales of God,2016,Signed lower left recto,Excellent condition.,Contemporary,Expressionism
267,267,267,30.000 USD,Danny Simmons,138.0,The Golden Path,2016,Signed verso,Excellent condition.,Contemporary,Abstract Expressionism
268,268,268,11.000 USD,Antonio Carreno,0.0,Racing Divine,2016,Signed lower right recto,Excellent condition.,Contemporary,Abstract Expressionism
269,269,269,30.000 USD,Danny Simmons,138.0,Traveling,2016,Signed verso,Excellent condition.,Contemporary,Abstract Expressionism
270,270,270,40.000 USD,Frank Schroeder,0.0,Endless Summer in the Garden,2016,Signed lower left recto,Excellent condition.,Contemporary,Abstract
271,271,271,40.000 USD,Frank Schroeder,0.0,1001 Nights,2016,Signed lower left recto,Excellent condition.,Contemporary,Abstract
272,272,272,6.000 USD,Mieke Marple,0.0,Exotic Garden (Venus Fly Trap),2021,Signed verso,Excellent condition.,Contemporary,Feminist Art 
273,273,273,6.000 USD,Mieke Marple,0.0,Exotic Garden (Flora),2021,Signed verso,Excellent condition.,Contemporary,Feminist Art 
274,274,274,19.000 USD,Henry Gunderson,0.0,Neurochamber,2019,Signed verso,Excellent condition.,Contemporary,Realism
275,275,275,12.000 USD,Mieke Marple,0.0,Bad Feminist (Blue Lace Medusa),2019,Signed verso,Excellent condition.,Contemporary,Feminist Art 
276,276,276,20.000 USD,Henry Gunderson,0.0,Down So Long It Looks Up,2019,Signed verso,Excellent condition.,Contemporary,Surrealism
277,277,277,22.500 USD,Christine Wang,160.0,Woman Yacht,2019,Signed verso,Excellent condition.,Contemporary,Realism
278,278,278,6.000 USD,Mieke Marple,0.0,Erotic Garden (Lily),2021,Signed verso,Excellent condition.,Contemporary,Feminist Art 
279,279,279,12.000 USD,Christine Wang,160.0,Leo Baby,2020,Signed verso,Excellent condition.,Contemporary,Realism
280,280,280,20.000 USD,Henry Gunderson,0.0,Scissor Lock,2019,Signed verso,Excellent condition.,Contemporary,Realism
281,281,281,8.500 USD,Dimitri Berea,0.0,"Untitled, Harbor Scene",1960 - 1969,Signed lower right recto,Not examined out of frame.No obvious signs of wear to art.Small nick and some scratches to the frame.Brown paper verso torn.  ,Post-War,Post-Impressionism
282,282,282,5.000 USD,Raymond Cauchetier,0.0,"'À bout de souffle' (Belmondo and Seberg, Champs Elysées, Paris)",1959,"Signed, titled and dated in pencil verso",Excellent condition.,Post-War,Realism
283,283,283,7.000 USD,Douglas Kirkland,0.0,"Audrey Hepburn, Paris",1965,Signed Certificate of Authenticity,Excellent condition.,Post-War,Realism
284,284,284,10.000 USD,Michael Kenna,86.0,"Ile de La Cite (Merci HCB), Paris, France",1992,"Signed, numbered, and dated in pencil recto; Signed, titled, dated and numbered with photographer's copyright stamp verso",Excellent condition.,Post-War,Realism
285,285,285,5.000 USD,Norman Parkinson,126.0,Cardin Hat Over Paris,1948,"Signed, stamped, titled and numbered by the Norman Parkinson Archive",Excellent condition.,Post-War,Realism
286,286,286,9.500 USD,Frances McLaughlin-Gill,0.0,"Fiona Campbell, The Palace at Versailles, Paris",1950,"Signed, dated and titled in pencil verso",Excellent condition.,Post-War,Realism
287,287,287,15.000 USD,Horst P. Horst,153.0,Dali Costumes - Paris,1939,"Blindstamped on recto; Signed, titled and dated in pencil and with photographer's stamp on verso",Excellent condition.,Modern,Realism
288,288,288,8.000 USD,Marc Riboud,140.0,"Yves Saint-Laurent, Paris",1964,Signed verso in pencil and with photographer's stamp,Excellent condition.,Post-War,Realism
289,289,289,6.000 USD,William Klein,168.0,Serge Gainsbourg (Cover for 'Love on the Beat' Album),1984,Signed in ink on the photographer's label on verso,Excellent condition.,Post-War,Realism
290,290,290,8.000 USD,Frances McLaughlin-Gill,0.0,Dior Black - Paris Collections for Vogue Magazine,1952,"Signed, dated and titled in pencil verso",Excellent condition.,Post-War,Realism
291,291,291,6.000 USD,William Klein,168.0,"Dorothy + Little Bara, Paris",1960,"Signed, dated and titled in pencil verso",Excellent condition.,Post-War,Realism
292,292,292,25.000 USD,George Hoyningen-Huene,0.0,"Divers, Paris",1930,"Embossed with photographer's stamp; Signed and inscribed ""From the collection of Horst"" by Horst P. Horst in pencil on verso",[nan],Modern,Realism
293,293,293,50.000 USD,Lillian Bassman,120.0,"Across the Restaurant at Le Grand Vefour, Barbara Mullen, Harper's Bazaar, Paris [Dress by Jacques Fath]",1949,Signed in pencil verso,Excellent condition.,Post-War,Realism
294,294,294,2.700 USD,Russell Young,142.0,Bardot,2007,Signed and numbered recto,Excellent condition.,Contemporary,Pop Art
295,295,295,16.000 USD,Russell Young,142.0,Marilyn Crying,2019,"Signed and numbered ""JX"" verso",Excellent condition.,Contemporary,Pop Art
296,296,296,15.000 USD,Russell Young,142.0,Elizabeth Taylor Portrait,2008,"Signed and numbered ""RY2008"" verso",Excellent condition.,Contemporary,Pop Art
297,297,297,22.000 USD,Russell Young,142.0,Audrey Hepburn,2019,"Signed and numbered ""FX"" verso",Excellent condition.,Contemporary,Pop Art
298,298,298,5.100 USD,Russell Young,142.0,Marilyn Hope,2013,Signed and numbered recto,Excellent condition.,Contemporary,Pop Art
299,299,299,5.100 USD,Russell Young,142.0,Marilyn Portrait,2011,Signed and numbered recto,Excellent condition.,Contemporary,Pop Art
300,300,300,32.000 USD,Russell Young,142.0,Kate Moss Diptych,2015,"Signed and numbered ""BII"" verso",Excellent condition.,Contemporary,Pop Art
301,301,301,15.000 USD,Russell Young,142.0,Elizabeth Taylor,2005,Signed and numbered verso,Excellent condition.,Contemporary,Pop Art
302,302,302,15.000 USD,Russell Young,142.0,Elizabeth Taylor,2005,Signed and numbered verso,Excellent condition.,Contemporary,Pop Art
303,303,303,15.000 USD,Russell Young,142.0,Elizabeth Taylor Portrait,2008,Signed and numbered verso,Excellent condition.,Contemporary,Pop Art
304,304,304,22.000 USD,Russell Young,142.0,Audrey Hepburn,2019,"Signed and numbered ""EX"" verso",Excellent condition.,Contemporary,Pop Art
305,305,305,15.000 USD,Russell Young,142.0,Elvis,2007,Signed and numbered verso,Excellent condition.,Contemporary,Pop Art
306,306,306,2.700 USD,Russell Young,142.0,Bardot,2007,Signed and numbered recto,Excellent condition.,Contemporary,Pop Art
307,307,307,16.000 USD,Russell Young,142.0,Marilyn Crying,2019,"Signed and numbered ""AX"" verso",Excellent condition.,Contemporary,Pop Art
308,308,308,13.000 USD,Russell Young,142.0,Elvis Pistol,2011,"Signed and marked ""RY PEACE"" verso",Excellent condition.,Contemporary,Pop Art
309,309,309,15.000 USD,Russell Young,142.0,Elvis,2007,Signed and numbered verso,Excellent condition.,Contemporary,Pop Art
310,310,310,1.295 USD,Aaron Siskind,86.0,Chicago 224,Late 20th Century ,[nan],This print is in generally excellent condition.,Post-War,Realism
311,311,311,5.995 USD,Harry Callahan,192.0,"Skyscraper with Person and Flagpole, New York",1977,Signed in pencil in the margin,"Print is in generally excellent condition.The colors are rich and saturated, with no apparent signs of fading.",Post-War,Realism
312,312,312,3.495 USD,Kota Ezawa,121.0,The Melody of Destiny,2008,[nan],"The transparency and light box are in generally excellent condition.Under close inspection, there are scattered hairline scratches and scuffs to the light box's plexiglass and metal components, none of which detract from its overall fine appearance.The electrical components of the light box are functional.",Contemporary,Conceptual 
313,313,313,3.495 USD,Kota Ezawa,121.0,Conical Intersect (After Gordon Matta-Clark 1975),2005,[nan],"The transparency and light box are in generally excellent condition.Under close inspection, there are scattered hairline scratches and scuffs to the light box's plexiglass and metal components, none of which detract from its overall fine appearance.The electrical components of the light box are functional.",Contemporary,Realism
314,314,314,9.995 USD,Sze Tsung Leong,142.0,"Lincoln Center, New York",2003,Signed in ink on the photographer's label on the reverse,"This chromogenic print is in generally excellent condition.The colors are rich and saturated, with no apparent fading.",Contemporary,Realism
315,315,315,3.995 USD,Kota Ezawa,121.0,Earth from Moon (After NASA 1969),2006,[nan],"The transparency and light box are in generally excellent condition.Under close inspection, there are scattered hairline scratches and scuffs to the light box's plexiglass and metal components, none of which detract from its overall fine appearance.The electrical components of the light box are functional.",Contemporary,Realism
316,316,316,3.995 USD,After Kota Ezawa,121.0,The Bohemians (After August Sander 1924),2006,[nan],"The transparency and light box are in generally excellent condition.Under close inspection, there are scattered hairline scratches and scuffs to the light box's plexiglass and metal components, none of which detract from its overall fine appearance.The electrical components of the light box are functional.",Contemporary,Realism
317,317,317,6.995 USD,Abelardo Morell,130.0,Camera Obscura Image of the Brooklyn Bridge in Bedroom,1999,"Signed, titled, dated, and numbered in pencil on the reverse",Print is in generally excellent condition.There is a tiny deposit of original retouching in the lower right corner and a crescent-shaped handling crease in the lower left that is only visible under raking light and does not appear to break the emulsion.,Post-War,Realism
318,318,318,2.995 USD,Harry Callahan,192.0,"Water Reflections, Bass Rocks, Massachusetts",Circa 1971,Signed in pencil in the margin,Print is generally in excellent condition.The colors are rich and saturated with no apparent fading.,Post-War,Realism
319,319,319,8.995 USD,Sze Tsung Leong,142.0,"Luohu District, Shenzhen",2008,Signed in ink on the photographer's label on the reverse,"This chromogenic print is in generally excellent condition.The colors are rich and saturated, with no apparent fading.",Contemporary,Realism
320,320,320,3.495 USD,Harry Callahan,192.0,"Beach and Shells, Horseneck Beach, Massachusetts",1978,Signed in pencil in the margin,Print is in generally excellent condition.The colors are rich and saturated with no apparent fading.,Post-War,Realism
321,321,321,3.995 USD,Harry Callahan,192.0,"Brown Grass, Horseneck Beach, Massachusetts",Circa 1971,Signed in pencil in the margin,Print is in generally excellent condition.The color appears rich and saturated with no apparent fading.,Post-War,Realism
322,322,322,13.500 USD,Charles Green Shaw,96.0,Giant Clutch,1965,Signed Charles Shaw and dated 1965 (on the reverse),"This work is unlined.The surface of the work is dirty with scattered pindots of surface accretion.Under UV: Although some pigments read strongly, they appear to be the artist's original.",Post-War,Abstract
323,323,323,4.000 USD,John Baldessari,128.0,Visionaire 64 Art Blue Edition,2014,Numbered on portfolio case,Screenprints are in excellent condition.,Contemporary,Conceptual 
324,324,324,17.000 USD,Charly Palmer,0.0,Erasing Memories,2020,Signed verso,Excellent condition.,Contemporary,Expressionism
325,325,325,17.000 USD,Charly Palmer,0.0,Tar Baby,2012,Signed by artist,Excellent condition.,Contemporary,Expressionism
326,326,326,14.000 USD,Lisa Oppenheim,139.0,California Wildfire 2010/2012 (Version II),2012,"Signed by the photographer in ink on a Tanya Bonakdar Gallery, New York, label on the reverse of the frame.",This work has not been examined unframed as issued. It appears to be in generally excellent condition. Framed under glass.,Contemporary,Abstract
327,327,327,1.250 USD,Devin Troy Strother,118.0,Grateful Dead Afro Cat Show,2021,Signed and numbered recto,Excellent condition.,Contemporary,Pop Art
328,328,328,1.250 USD,Devin Troy Strother,118.0,Grateful Dead Afro Cat Show,2021,Signed and numbered recto,Excellent condition.,Contemporary,Pop Art
329,329,329,9.500 USD,Ludwig Bemelmans,167.0,Madeline,First Half 20th Century ,Signed Bemelmans lower right.,Occasional light toning on edges. ,Modern,Art Deco
330,330,330,2.000 USD,Jutta Koether,123.0,Untitled,1992,Signed and dated lower right rectoInscribed verso,No obvious signs of wear.,Contemporary,Expressionism
331,331,331,3.000 USD,James Siena,84.0,Spacelock (second version),1999,[nan],Not examined out of frame.No obvious signs of wear or damage.,Contemporary,Geometric Abstraction
332,332,332,1.500 USD,Enoc Perez,83.0,Untitled,2005,"Signed, dated and inscribed verso",No obvious signs of wear.,Contemporary,Realism
333,333,333,1.200 USD,Carter Mull,0.0,Untitled (Screen),2006 - 2007,[nan],This work is in very good condition.Not examined out of frame.No obvious signs of wear or damage.,Contemporary,Abstract Expressionism
334,334,334,3.000 USD,James Siena,84.0,Antenna,2003,[nan],Not examined out of frame.No obvious signs of wear or damage.,Contemporary,Geometric Abstraction
335,335,335,3.000 USD,Mike Bidlo,114.0,"Not Warhol, Marilyn",1984,[nan],This work is in very good condition.No obvious signs of wear.,Contemporary,Pop Art
336,336,336,1.000 USD,Jennifer Reeves,0.0,"Place, 4-17",1997,Signed and dated verso,No obvious signs of wear.,Post-War,Conceptual 
337,337,337,1.000 USD,Justine Kurland,130.0,Explorer,2000,Signed on gallery sticker verso,Laminate rippling at top center.Not examined out of frame.No obvious signs of wear to photograph.,Contemporary,Realism
338,338,338,1.500 USD,Sarah Braman,133.0,Indian Summer 8 pm,2010,Signed and dated verso,No obvious signs of wear.,Contemporary,Abstract
339,339,339,2.550 USD,James Siena,84.0,"Taste The Houses, Twirly, Upside Down Devil",1997,Signed lower right recto,No obvious signs of wear.,Contemporary,Geometric Abstraction
340,340,340,4.000 USD,Michele Abeles,0.0,3-Way,2013,Signed on the reverse.,Not examined out of frame.No obvious signs of wear or damage.,Contemporary,Conceptual 
341,341,341,1.500 USD,Kika Karadi,0.0,Untitled (OPM No. 1),2014,"Signed, titled and dated on the reverse",No obvious signs of wear or damage.,Contemporary,Abstract
342,342,342,10.000 USD,Julia Rommel,117.0,Hobby,2012,Signed and dated on reverse ,No obvious signs of wear or damage.,Contemporary,Conceptual 
343,343,343,2.250 USD,CARL VAN VECHTEN,0.0,Dizzy Gillespie,1955,[nan],This work is in very good condition.No obvious signs of wear or use.,Post-War,[nan]
344,344,344,4.000 USD,Flip Schulke,0.0,"Cassius Clay, Miami Beach",1961,"Signed and copyrighted in pencil and with a Flip Schulke studio label annotated ‘PAGE: 16.’ in ink, on the reverse.","This print is in generally excellent condition. The margin edges are worn and there is a sharp crease in the upper left margin corner that does not appear to break the emulsion. ‘#40 in show’ is written in pencil on the reverse, possibly in the photographer’s hand.",Post-War,Realism
345,345,345,800 USD,Carl Roters,0.0,Two Trappers ,Circa 1970,Signed lower right,No apparent signs of damage to artwork.Not examined out of frame.Frame with minor wear.,Post-War,Realism
346,346,346,800 USD,Carl Roters,0.0,Indian Horses,1971,Signed and dated 1971 lower right,No apparent signs of damage to artwork.Not examined out of frame.Overmat with several wrinkles.Frame with minor wear.,Post-War,Realism
347,347,347,30.000 USD,Robin Rhode,80.0,Ballad to Ballet,2008,[nan],Work appears to be in good condition. Light dust throughout. Some frames are scratched and dinged.,Contemporary,Conceptual 
348,348,348,18.000 USD,Dashiell Manley,112.0,"Triangles (Front, Back, Blue Gels, Fingers)",2013,[nan],Good condition.,Contemporary,Abstract
349,349,349,15.000 USD,Jessica Jackson Hutchins,101.0,Punctuation,2011,[nan],The work appears to be in excellent condition. The piece is framed. There are some very small pieces of material in the bottom of the frame that have come away from the piece. This work has not been inspected out of the frame.,Contemporary,Abstract
350,350,350,12.000 USD,Artie Vierkant,0.0,Image Object Sunday 12 February 2012 6:22pm,2012,[nan],Artwork not inspected.,Contemporary,Abstract
351,351,351,23.000 USD,James Welling,177.0,Glass House,2010,"Signed, titled, dated and numbered lower recto",Excellent condition. Frame has slightly cracked miter joint on upper right corner.,Contemporary,Conceptual 
352,352,352,128.000 USD,John Baldessari,128.0,"National City (W,1,2,3,4,5,6,B)",1996 - 2009,Signed on the reverse.,Excellent condition.,Contemporary,Pop Art
353,353,353,160.000 USD,Alex Katz,190.0,Black Dress Portfolio,2015,Signed and numbered,Excellent condition.,Contemporary,Pop Art
354,354,354,6.500 USD,Biff Elrod,0.0,Other Woman I,2011,"Front lower left ""B.F. Elrod""",Excellent condition.,Contemporary,Pop Art
355,355,355,5.500 USD,Biff Elrod,0.0,G-OW-RW,2008,Signed verso ,Excellent condition.,Contemporary,Pop Art
356,356,356,5.000 USD,Flip Schulke,0.0,"Cassius Clay at the 5th Street Gym, Miami Beach, FL",1961,Signed and copyrighted in pencil and with a Flip Schulke studio label on the reverse.,This print is in generally excellent condition. There are some fingerprints in the upper right quadrant.,Modern,Realism
357,357,357,4.500 USD,Ralph Morse,0.0,Cassius Clay After Defeating Sonny Liston,1964,[nan],"This early print is in generally very good condition. Visible under close inspection are some scuffs, soft handling creases and an approximately one-inch crease in the lower left quadrant that appears to break the emulsion. There is minor edge wear, with some sharp creases that break the emulsion and occasional losses. On the reverse are numerous reproduction notations in crayon and graphite in unidentified hands.",Modern,Realism
358,358,358,4.000 USD,John Shearer,137.0,Muhammed Ali (Training),[nan],[nan],"This print is in generally very good condition. Visible under close examination are hairline scratches, some cloudy areas that may be the result of processing, scuffs, and soft handling creases. ‘25619 / 6C13M 27’ Is written in pencil in an unidentified hand on the reverse.",Modern,Realism
359,359,359,4.000 USD,Flip Schulke,0.0,Cassius Clay training in a pool at the Sir John Hotel in Miami,1964,"Blindstamped by the photographer’s archive in the margin.Signed and copyrighted in pencil on the reverse, a Flip Schulke, West Palm Beach studio label on the reverse annotated ‘M. Ali’ in ink.",[nan],Modern,Realism
360,360,360,4.000 USD,Flip Schulke,0.0,"Muhammad Ali at the Fifth Street Gym, Miami Beach",1964,"A Flip Schulke, West Palm Beach studio label on the reverse, annotated ‘1964’ in red ink.",This print is in generally excellent condition. There are occasional hairline scratches. In the margin is a piece of adhesive with ‘P74’ and ‘63%’ written in pencil in an unidentified hand.,Modern,Realism
361,361,361,22.500 USD,Christopher Williams,163.0,"CUTAWAY MODEL NIKKOR ZOOM LENS 50-300MM Ƒ/4.5. PHOTOGRAPHY BY THE DOUGLAS M. PARKER STUDIO, LOS ANGELES, CALIFORNIA, OCTOBER 13, 2007 - OCTOBER 29, 2007",2007,"Signed, partially titled, dated 08 and numbered AP on the reverse","This work is in very good condition overall.There is a light layer of surface dust that has adhered to the surface.Under very close inspection there is a white spot accretion, 7 inches from the top edge and 10 inches from the left edge.",Contemporary,Realism
362,362,362,37.000 USD,Marcel Dyf,129.0,Fille aux Violets,1957,Signed Dyf bottom left in paint,"Overall very good condition.Small chip to canvas at left side, middle.Occasional scratching and chips at frame corners.Not examined out of frame.",Post-War,Impressionism
363,363,363,9.350 USD,Mickalene Thomas,144.0,Portrait of Marie Sitting in Black and White,2012,[nan],Excellent condition.Not examined out of frame.,Contemporary,Conceptual 
364,364,364,14.680 USD,Mickalene Thomas,144.0,Madame Mama Bush in Black and White,2007 - 2011,"Signed, dated, and titled in ink on verso.",Excellent condition.,Contemporary,Conceptual 
365,365,365,20.000 USD,Hiroshi Sugimoto,132.0,Helicoid Minimal Surface,2004,Signed in front under the mat on the right side.,Excellent condition.,Contemporary,Conceptual 
366,366,366,20.000 USD,Hiroshi Sugimoto,132.0,Differential Bevel Gear,2004,Signed in front under the mat on the right side.,Excellent condition.,Contemporary,Conceptual 
367,367,367,5.000 USD,Berndnaut Smilde,128.0,Iconoclouds,2013,Artist and printer chops on right front.,Excellent condition.,Contemporary,Conceptual 
368,368,368,25.000 USD,Ed  Ruscha,173.0,Sin,1970,"Signed, dated and numbered on front left corner.",Excellent condition.,Contemporary,Conceptual 
369,369,369,5.000 USD,Allan  McCollum,85.0,Lands of Shadow and Substance #27,2014,[nan],Excellent condition.,Contemporary,Conceptual 
370,370,370,5.000 USD,Allan  McCollum,85.0,Lands of Shadow and Substance #21,2014,[nan],Excellent condition.,Contemporary,Conceptual 
371,371,371,5.000 USD,Allan  McCollum,85.0,Lands of Shadow and Substance #2,2014,[nan],Excellent condition.,Contemporary,Conceptual 
372,372,372,2.000 USD,Sophie Von Hellermann,131.0,Untitled ,2010,"Signed ""Sophie von Hellermann"" in block capitals and with the artist's signature.",No obvious signs of wear or use. ,Contemporary,Expressionism
373,373,373,2.000 USD,Dawn Mellor,0.0,Untitled ,1998,"Signed ""Dawn Mellor"" in block capitals and with the artist's signature.",Minor losses to paint layers on edges.Water damage on verso. ,Contemporary,Expressionism
374,374,374,3.000 USD,Gillian Carnegie,122.0,Untitled ,1998,"Signed ""Gillian Carnegie"" in block capitals and with the artist's signature.",No obvious signs of wear or use. ,Contemporary,Impressionism
375,375,375,6.000 USD,Lawrence Weiner,160.0,BE THAT AS IT MIGHT - ASPIRE,2009,"Signed ""Lawrence Weiner"" in block capitals and with the artist's signature.",Occasional smudges and wear to corners. ,Contemporary,Conceptual 
376,376,376,15.500 USD,Paul Lucien Maze,0.0,Oxford from Christ Church Pavilion,20th Century ,Signed Paul Maze lower left recto,No obvious signs of wear to art.Not examined out of frame.Minor frame abrasion and chips to gilt at edges.,Post-War,Post-Impressionism
